{
  "version": 1,
  "task_id": "TASK-0035",
  "handover_sha256": "1f651ac68eae097dc19523c89ee7b48f1c9c39a620b9a0cae7069fc579ee3169",
  "ingested_at": "2026-08-01T10:30:39+10:00",
  "updated_pages": [
    "wiki/semantic/schemas/development-agent-harness-config.md"
  ],
  "created_decisions": [],
  "deferred": []
}
